访问复旦,﻿,欢迎,您访问复旦大学主页,,,,,﻿欢迎您访问复旦大学主页，在这里您可以通过访问各个栏目获取有关信息，也可以通过“搜索复旦”快速获得网站内容、联系方式、院系信息等方面的信息。
访问复旦,﻿,访问,复旦大学主页,,,,,﻿欢迎您访问复旦大学主页，在这里您可以通过访问各个栏目获取有关信息，也可以通过“搜索复旦”快速获得网站内容、联系方式、院系信息等方面的信息。
访问复旦,﻿,可以,通过访问各个栏目获取有关信息,,,,,﻿欢迎您访问复旦大学主页，在这里您可以通过访问各个栏目获取有关信息，也可以通过“搜索复旦”快速获得网站内容、联系方式、院系信息等方面的信息。
访问复旦,﻿,访问,各个栏目获取有关信息,,,,,﻿欢迎您访问复旦大学主页，在这里您可以通过访问各个栏目获取有关信息，也可以通过“搜索复旦”快速获得网站内容、联系方式、院系信息等方面的信息。
访问复旦,﻿,获取,有关信息,,,,,﻿欢迎您访问复旦大学主页，在这里您可以通过访问各个栏目获取有关信息，也可以通过“搜索复旦”快速获得网站内容、联系方式、院系信息等方面的信息。
访问复旦,﻿,可以,通过“搜索复旦”,,,,,﻿欢迎您访问复旦大学主页，在这里您可以通过访问各个栏目获取有关信息，也可以通过“搜索复旦”快速获得网站内容、联系方式、院系信息等方面的信息。
访问复旦,﻿,获得,网站内容、联系方式、院系信息等方面的信息,,,,,﻿欢迎您访问复旦大学主页，在这里您可以通过访问各个栏目获取有关信息，也可以通过“搜索复旦”快速获得网站内容、联系方式、院系信息等方面的信息。
访问复旦,复旦大学总机复旦大学总机,为,,,复旦大学,,86-21-65642222,复旦大学总机为86-21-65642222，您也可以联系卿云轩校园接待中心获得校园导览方面的服务。
访问复旦,您,可以,卿云轩校园接待中心获得校园导览方面的服务,,,,,复旦大学总机为86-21-65642222，您也可以联系卿云轩校园接待中心获得校园导览方面的服务。
访问复旦,您,联系,卿云轩校园接待中心获得校园导览方面的服务,,,,,复旦大学总机为86-21-65642222，您也可以联系卿云轩校园接待中心获得校园导览方面的服务。
访问复旦,您,获得,校园导览方面的服务,,,,,复旦大学总机为86-21-65642222，您也可以联系卿云轩校园接待中心获得校园导览方面的服务。
访问复旦,复旦大学总机复旦大学总机,访问,复旦大学校史馆、上海医科大学校史陈列室您,,,,,通过访问复旦大学校史馆、上海医科大学校史陈列室您可以了解我校的校史。
访问复旦,您,可以,我校的校史,,陈列室,,,通过访问复旦大学校史馆、上海医科大学校史陈列室您可以了解我校的校史。
访问复旦,您,了解,我校的校史,,陈列室,,,通过访问复旦大学校史馆、上海医科大学校史陈列室您可以了解我校的校史。
访问复旦,复旦大学,有,邯郸路校区、江湾校区、枫林校区、张江校区四个校区，构成以邯郸路校区、江湾校区为“一体”，枫林校区、张江校区为“翼”的“一体两翼”的校区布局,,复旦大学,,四,复旦大学有邯郸路校区、江湾校区、枫林校区、张江校区四个校区，构成以邯郸路校区、江湾校区为“一体”，枫林校区、张江校区为“翼”的“一体两翼”的校区布局。
访问复旦,复旦大学,枫林,校区张江校区四个校区,,复旦大学,,四,复旦大学有邯郸路校区、江湾校区、枫林校区、张江校区四个校区，构成以邯郸路校区、江湾校区为“一体”，枫林校区、张江校区为“翼”的“一体两翼”的校区布局。
访问复旦,复旦大学,构成,以邯郸路校区、江湾校区为“一体”，枫林校区、张江校区为“翼”的“一体两翼”的校区布局,,,,,复旦大学有邯郸路校区、江湾校区、枫林校区、张江校区四个校区，构成以邯郸路校区、江湾校区为“一体”，枫林校区、张江校区为“翼”的“一体两翼”的校区布局。
访问复旦,复旦大学,枫林,校区、张江校区为“翼”的“一体两翼”的校区布局,,,,,复旦大学有邯郸路校区、江湾校区、枫林校区、张江校区四个校区，构成以邯郸路校区、江湾校区为“一体”，枫林校区、张江校区为“翼”的“一体两翼”的校区布局。
访问复旦,各校区周边交通,方便,,,,,,各校区周边交通方便，生活便利。
访问复旦,生活,便利,,,,,,各校区周边交通方便，生活便利。
访问复旦,校园环境,优美,,,,,,校园环境优美，有多种体育设施供师生使用。
访问复旦,体育设施,供,师生使用,,,,有多,校园环境优美，有多种体育设施供师生使用。
访问复旦,体育设施,使用,,,,,有多,校园环境优美，有多种体育设施供师生使用。
访问复旦,校区,有,定时校车互相交通,,,,,校区之间有定时校车互相交通，机场、火车站等交通集散地与复旦大学之间有多种交通方式可以利用。
访问复旦,复旦大学,有,多种交通方式可以利用,,复旦大学,,多,校区之间有定时校车互相交通，机场、火车站等交通集散地与复旦大学之间有多种交通方式可以利用。
访问复旦,复旦大学,可以,,,复旦大学,,多,校区之间有定时校车互相交通，机场、火车站等交通集散地与复旦大学之间有多种交通方式可以利用。
访问复旦,复旦大学,利用,,,复旦大学,,多,校区之间有定时校车互相交通，机场、火车站等交通集散地与复旦大学之间有多种交通方式可以利用。
